{
  "ModelInfo": {
    "modelName": "Beispielmodell Astronomie",
    "modelType": "Information model",
    "mainLanguage": "de",
    "modelVersion": "0.9",
    "languages": [
      "en"
    ],
    "targetEnvironment": "Informatiosmodell Standard",
    "originTool": "dataspot"
  },
  "Categories": [
    {
      "elementId": "CATG0",
      "name": "myname",
      "categoryType": "ENTITY",
      "categoryId": "CATG1"
    }
  ],
  "Domains": [
    {
      "elementId": "DOMA26",
      "name": {
        "de": "Leuchtklasse",
        "en": "Luminosity class"
      },
      "description": {
        "de": "Leuchtkraftklassen (Helligkeitstypen) \nI\t\u00dcberriesen\tBetelgeuse (M1I)\nII\tHelle Riesen\t\nIII\tRiesen\tAldebaran (K5III)\nIV\tUnterriesen\t\nV\tHauptreihe (normale Sterne)\tSonne (G2V)\nVI\tUnterzwerge\t\nD\tWei\u00dfe Zwerge\tSirius B",
        "en": "Luminosity classes (brightness types)\nI Supergiant Betelgeuse (M1I)\nII Bright giants\nIII Giants Aldebaran (K5III)\nIV Subgiants\nV Main sequence (normal stars) Sun (G2V)\nVI Subdwarfs\nD White dwarfs Sirius B"
      },
      "categoryId": "CATG5",
      "domainType": "LOVDomain",
      "values": [
        {
          "value": "VI",
          "displayValue": {
            "de": "Unterzwerge",
            "en": "Subdwarfs"
          },
          "description": {
            "de": "auch sd, Betelgeuse (M1I)"
          }
        },
        {
          "value": "III",
          "displayValue": {
            "de": "Riesen",
            "en": "Giants"
          },
          "description": {
            "de": "Aldebaran (K5III)"
          }
        },
        {
          "value": "I",
          "displayValue": {
            "de": "\u00dcberriese",
            "en": "Supergiant"
          },
          "description": {
            "de": "Unterteilung der \u00dcberriesen nach abnehmender Leuchtkraft Ia-0, Ia, Iab, Ib"
          }
        },
        {
          "value": "V",
          "displayValue": {
            "de": "Hauptreihe",
            "en": "Main sequence"
          },
          "description": {
            "de": "normale Stern, Sonne (G2V)"
          }
        },
        {
          "value": "0",
          "displayValue": {
            "de": "Hyperriese",
            "en": "Supergiant"
          },
          "description": {
            "de": "Deneb, S Doradus"
          }
        },
        {
          "value": "VII",
          "displayValue": {
            "de": "Wei\u00dfe Zwerge",
            "en": "White dwarf"
          },
          "description": {
            "de": "Auch D,  Sirius B"
          }
        },
        {
          "value": "IV",
          "displayValue": {
            "de": "Unterriesen",
            "en": "Subgiants"
          }
        },
        {
          "value": "II",
          "displayValue": {
            "de": "Helle Riesen",
            "en": "Bright Giants"
          }
        }
      ]
    }
  ],
  "Entities": [
    {
      "elementId": "ENTI1",
      "name": {
        "de": "Mond",
        "en": "Planets Moon"
      },
      "shortDescr": {
        "de": "Fester Himmelsk\u00f6rper der um einen Planeten kreist",
        "en": "Fixed celestial body orbiting a planet"
      },
      "examples": [
        "(Erd-)Mond",
        "Phobos",
        "Deimos",
        "Io",
        "Europa",
        "Ganymed",
        "Triton",
        "Charon"
      ],
      "keys": [
        {"name":"1","elements":[
          "RELA2",
          "ATTR27"
        ]}
      ]
    }
  ],
  "Attributes": [
    {
      "elementId": "ATTR0",
      "name": "Attr1",
      "parentId": "ENTI0",
      "displaySeq": 2,
      "domainId": "DOMA001",
      "descriptive": true,
      "historicised": false,
      "translated": true,
      "examples": [
        "Farbe",
        "Koordinate"
      ],
      "description": {
        "en": "Purpose, usage, meaning of an attribute value hold by this attribute."
      },
      "shortDescr": "Short text to be displayed as help to understand the purpose of this attribute in user interfaces.",
      "mandatory": true,
      "repeated": true,
      "encrypted": false,
      "additionalProps":
        {
          "$comment": "Entityattribute, see parent"
        }
    }
  ],
  "Relations": [
    {
      "elementId": "RELA8",
      "relationType": "SUBTYPE",
      "fwd": {
        "entityId": "ENTI7",
        "assocText": {
          "de": "ist",
          "en": "is"
        },
        "cardinality": "1",
        "mandatory": true
      },
      "bwd": {
        "entityId": "ENTI1",
        "assocText": {
          "de": "ist",
          "en": "is"
        },
        "cardinality": "1",
        "mandatory": true,
        "arcNumber": 0
      }
    }
  ],
  "BusinessRules": [
    {
      "elementId": "BURU3",
      "restrictedElements": [
        "ENTI5"
      ],
      "description": "Ein Asteriod umkreist immer genau einen Stern oder einen Asteroiden (aber nicht sich selbst)"
    }
  ],
  "additionalProps":
    {
      "Who": "me"
    }
}